,URL,Genre,Modified,Context
119,https://archiveofourown.org/works/30992711,Drama,Growing up I always knew life would never be easy or simple. I understand there will be complications along the way despite being sheltered by my mom. I understand I will not get what I want like a fairytale princess romance relationship. I understand relationships will have hard times and easy times. I understand growing up will be a rollercoaster of emotions and trials.,Challenging journey toward self discovery.
120,https://archiveofourown.org/works/30333903,Drama,HeroIm late. Again. One more time and I can consider myself fired. I keep forgetting to set my fucking alarm its been hard getting used to US time after 23 years in London. Its not like that tired old excuse will fly with my boss though. I have been living in California for almost two months after all.,"Running late again, stressful job at stake, new city life struggle"
121,https://archiveofourown.org/works/32734090,Fantasy,Normally when you imagine a halfdrowned panicstricken person crawling out of the surf to frantically scrabble their way above the high tide line and collapse behind a rock you imagine someone nominally human. You know two arms two legs the works. You expect it to be after an unfortunate boating accident perhaps a wreck or even just a swimmer towed out by the rip tide and very happy to be back somewhere safe.,Desperate escape from watery doom
122,https://archiveofourown.org/works/43178277,Thriller,The Kid Detectives Network Presents The Rescue August 18 2025. 400 PM EST. Phoenix Arizona. The footage starts with a Caucasian male sitting at an interview table silently reading through a large file in front of him. A tape recorder rests on the table next to him clearly going. Directly across from him is a lone figure left wrist wrapped in a makeshift cast.,Desperate man seeks missing person.
123,https://archiveofourown.org/works/35689690,Drama,Agatha padded around the rented Chelsea flat. It was spacious and comfortable. One advantage she thought of having spent the early decades of her life working her ass off with very little regard for friends or distractions was that now when she needed money to throw around she had money to throw around. She took stock of her current circumstances.,Agatha enjoys comfortable retirement.
124,https://archiveofourown.org/works/23638744,Comedy,Its all Roys fault. A lot of things in Agathas life have been Roys fault. Her dreadful milestone birthday shes absolutely not going to think about which one because a lady never tells her age and shes not technically a lady but she still doesnt want to think about it the thing with the stripper and then the terrible Carsley School Gala which in hindsight was mostly her fault but shell easily blame Roy anyway.,Absolutely avoids dreaded milestone birthday
125,https://archiveofourown.org/works/38918361,Romance,Farmboy Jude lifted his head toward the voice his beautiful Anton. Judes family had been working for Antons family for many years and as his mother took care of Antons mother Jude cared for Anton. Jude raised an eyebrow in response to Antons call. Fetch me some water. As you wish. That was all Jude ever said to Anton.,Farm boy responds to master's command.
126,https://archiveofourown.org/works/36120361,Fantasy,Act I The Keeper of the Word Chapter 1 Beru When I was eleven I wrote a love letter to Hector but chickened out and gave it to Ephyra instead. It was a memory that was both embarrassing and funny embarrassing when it happened but quite humorous in hindsight.,Beru's secret letter causes misunderstandings with her friends
127,https://archiveofourown.org/works/35114968,Romance,Whatever It Takes Chapter 1 Gone Anton was gone.At first Jude didnt realize it. He didnt want to realize it. Instead he looked and searched and used his Grace looking for a sign of him for any sign something that would lead him to the boy he loved.,"Gone without a trace, love searches frantically"
128,https://archiveofourown.org/works/34705672,Horror,ANDREW Before him knelt a priest begging for his life. They were in a moonlit room one that gave a perfect view of the City of Faith. I swear it I wont hurt them anymore. Have mercy I will repent. He cried hands reaching for Andrews boots. He crushed them beneath his feet satisfied by the crunch that followed. Something like rage swirled beneath his skin a deep emotion.,Moonlit room view of Faith
129,https://archiveofourown.org/works/34096480,Romance,The Last Prophet You dont believe its Hector but you still want it to be him.Its such a selfish thought a thought you are not allowed to speak out loud but a thought that stays with you throughout the years. Maybe its because you love him. Maybe its because he doesnt love you.Or maybe its because you are drawn to the things you cannot have.You dont know. It doesnt matter.,The Lost Desire
130,https://archiveofourown.org/works/33831340,Romance,The First Five Days First Day Take your clothes off Anton says.Jude freezes. What He must have misheard. There is no way Anton is saying what Jude thinks hes saying. Take your clothes off.Anton rolls his eyes. If I wanted to see you naked I would say so Jude. But right now I care more about not being recognized. Thats why we have to change our clothes.Judes cheeks flush pink.,Change Clothes to Hide identity
131,https://archiveofourown.org/works/33105919,Dystopian,The Lights Touch Jude is five when the full weight of his destiny settles on his shoulders.Its the day his father tells him Now your training will begin. But its also the day his father tells him From now on dont allow anyone to touch your skin.Why Jude asks. He doesnt understand. And so his father explains.,Boy's secretive destiny starts with isolation
132,https://archiveofourown.org/works/31663064,Romance,Ephyra Shara Word of advice Never turn your back on lowlifes. Its something Shara had to learn as well so shes glad she can share this advice with others especially with such a suspicious looking girl. Not that Shara minds her appearance in fact she loves suspicious looking girls. She is already thrilled to learn her story although she would never admit that.,Thrilled to hear dangerous tale
133,https://archiveofourown.org/works/31102808,Drama,I have to do this. Hes back.His lungs contract and Anton can barely breathe. Seeing the lake again is even worse than he expected. Memories assault him like his brother used to do horrible memories he wanted so badly to forget. He is shaking his knees give way under him but Jude doesnt let him fall. He is there by his side like always. He supports him in more ways than one.,Poor guy relives painful past at lakefront
134,https://archiveofourown.org/works/41532681,Romance,Do you love me Halaflora asked a kind shimmer in her eyes as she looked up at him. The Copper chuckled and pressed his head against hers Of course I do. Halaflora hummed she had such a lovely voice her boney frame doing its best to scooch closer to her mate.,"She treasures his affection, he glows with contentment"
135,https://archiveofourown.org/works/33562756,Adventure,We exited the portal like we had many planets before. I took in the scent of the air. Dry. Great. This is so great Heather another world. My boyfriend well more like my fiance Casey said from next to me. We were experienced travelers and had all we needed and nothing more really. We were Beastials Anthro Beastials. I was a Pureblooded Blacktip shark beastial anthro. Try saying that five times fast.,Savannah landscape vast dry plains
136,https://archiveofourown.org/works/33562567,Drama,I couldnt take it anymore. The insults the rejection the loneliness My hooves hit the ground hard and fast. My vision was blurred as I let out my cries and sorrows to the moon. Im Button Mash and Im a loser. Fourteen and no cutie mark the filly of my dreams or at least my crush since I was nine rejected me for that dragon Spike.,Broken-hearted horse flees to the moonlight.