,URL,Genre,Modified,Context
60,https://archiveofourown.org/works/9493139,Fantasy,Tony poked his computer although he really didnt have any illusions about coming up with a lead. Lance Corporal Richards had been into some shady stuff but it wasnt the sort Tony could investigate. Give him a strip club or a BDSM club or a country club or even a gay club and Tony could slide right into the role. He could wear a thousand masks some hed worn for years.,Lone detective pursues thread of tawdry vice.
61,https://archiveofourown.org/works/39619761,Fiction,Concurrent with fair dealing clauses of the Copyright Act R.S.C. 1985 c. C42 of Canada and fair use clauses in copyright legislation in other nations this is a work that was created solely for entertainment purposes. Furthermore it is posted freely on the Internet without expectation or requirement of remuneration.,An adventurous princess travels to find love and happiness outside her kingdom.
62,https://archiveofourown.org/works/29949861,Fantasy,Harry povHarry was running running as fast as he could it was the one thing he was good at.Running away from his cousin Dudley and his mean friends. Clutching his brown lunch given to him by his teacher when she realized he was the only kid at the schools picnic that didnt have one.,"Boy chased, runs with free lunch."
63,https://archiveofourown.org/works/24510304,Fiction,Concurrent with fair dealing clauses of the Copyright Act R.S.C. 1985 c. C42 of Canada and fair use clauses in copyright legislation in other nations this is a work that was created solely for entertainment purposes. Furthermore it is posted freely on the Internet without expectation or requirement of remuneration.,1980s-inspired office setting
64,https://archiveofourown.org/works/19427545,Mystery,The Winchester family was a force to stay away from. Each member carried with them a very long list of creatures they destroyed along with an endless list of everything they would do to make sure their loved one was safe and alive. It all started with John Winchester the father.,They protect at any cost
65,https://archiveofourown.org/works/24768523,Horror,For a place that is called the city that never sleeps there are some things in New York City that slip through the cracks. Forgotten sometimes for a good reason. Alexei should be asleep by now. Hes 13 after all and those 8 hours of sleep should be important to him.Unfortunately hes not in his room.Hes in a dark alley in the Big Apple waiting for someone.,Daring street encounter at midnight.
66,https://archiveofourown.org/works/20874956,Fantasy,Sometimes the heroes dont win. Sometimes they do. But victory for the living doesnt last forever. And neither for the dead. Henry knew this long before he ever met Abraham. But now the concept rang painfully true as he watched his protege and friend suffer through the last moments of his life. It was terrible. It was sickening. Abe was sprawled out on a bed unable to move while Mary held his hand.,Intense battle with no clear victory
67,https://archiveofourown.org/works/46086385,Romance,December would never get used to the cold side of the bed. Just nine months ago there was a warm body there. Nine months ago there was a girlfriend snoring next to them. Nine months ago December had a hero in their arms they felt like Hyacinthus cradling Apollo but by those terms they should have died. Nine months ago.,Warmth turns cold after love dissipates
68,https://archiveofourown.org/works/38542450,Dark Fanrasy,This is a work of FICTION made by and for adults. The following chapter includes depictions of trauma cutting minor bleeding and unintentional suicide. Reader discretion is advised.As the waning moon rose in the near dark of twilight a young woman turned her head swiftly towards a faint glow in the distance disturbing her frizzy ginger locks.,"Horrific encounter with an unidentified light source while walking alone at dusk."""
69,https://archiveofourown.org/works/50222629,Comedy,Jens Cis 1In the beginning God yeah him decided she wanted to be productive So she just kinda grabbed a whole bunch of lumpy space lumps and went WABOOM And created the Heavens and the earth. The earth was all lonely and shit and like SUPER dark.,She crafted vibrant worlds from chaotic matter.
70,https://archiveofourown.org/works/43641643,Fantasy,Legacy of the Moon Arc I Forbidden End Chapter 1 Prelude to Chaos Around 1100 years ago Bernhard Castle somewhere in presentday Europe The very history of mankind is the witness that in the race of overthrowing each other its been several times that humans have made pacts with otherworldly entities especially the evil ones which dwell in the dark realms of this universe.,Power-hungry kingdom seeks ancient power
71,https://archiveofourown.org/works/47924275,Adventure,Blaine woke up on Sunday morning to the sound of rain pitterpattering against the skylight window. Gosh he loved Germany. The fact that it actually rained more than once or twice a year was a refreshing contrast to the weather in Mesa. And springtime it seemed was when the skies really opened.This was his first spring here after arriving late last summer following his postgraduation weeks in the Missionary Training Center.,Waking up to rain on a German Sunday morning
72,https://archiveofourown.org/works/50173360,Drama,Isabella Knockwood laid on her bed looking at the ceiling wondering how her life had ended up like this. Broken home divorced parents alcoholic dad the list went on. Her mother left her and her younger sister Mary with their father after the divorce papers were filed moving off the reservation to some place in Halifax never coming back.That had been a year ago and things hadnt improved since.,Childhood trauma halifax home.
73,https://archiveofourown.org/works/48283102,Fantasy,Take the children desperately he pushed Selina aside. In the place where the woman was a large crater appeared from which a smoldering flame crackled. Ludger didnt pay attention to what was going on behind him studying the picture in front of him. To feel the tension growing with every minute... This was the main rule if you wanted to win in a deliberately uneven fight.,"Desperate man distracted by art, ignoring danger."
74,https://archiveofourown.org/works/45538423,Fantasy,So Ludgernim really was a soldier Selina mumbled trailing off before asking the man himself.What was it like in the militaryIt doesnt matter.Ludger hadnt actually been a part of the military so there wasnt anything he could say although perhaps it was similar to his time as a mercenary. His colleague still gave him a respectful look praising him.,Military veteran refuses discussion about past.
75,https://archiveofourown.org/works/48856636,Fantasy,Ludger glares at the marionette standing infront him yes a marionettehed probably die if he actually looked at him like that hes only a seq 4 for Evernig.is something wrong with that I cant even get tired anymore Merlin twirls hes silk hat around hes gloved fingerhe had no reason to act like merlin hermes when hes in front of ludger.,glowers at a threatening marionette
76,https://archiveofourown.org/works/46639645,Adventure,Evacuate the students to a safe place Ill hold up here.Understood.Though Selina was reluctant to leave Ludger behind she knew that the situation was urgent and it was no time to be worrying after all he used to be in the military and had already displayed his overwhelmingly skilful control of magic.She hurried the students protecting them from the barrage of incoming projectiles with her spirits as they left the scene.,"Urgent evacuation, dangerous situation"
77,https://archiveofourown.org/works/47038357,Mystery,Simplicity has its limits your interests dull my eyes Grander had said monotonously carefully watching and waiting to prey on the reaction of her disciple.Beauty lies in the eye of the beholder he replied with a classic proverb not daring to further disappoint the elder.Their journey to the city of a nearby country had encountered a dead end.,Travelers face unexpected obstacle.
78,https://archiveofourown.org/works/48654580,Adult,Ive been reading a lot of QA fics lately but there are several series that I would love to ask questions about but I havent seen anyone include. And so I decided to write one myself. Aside from this one Ive also got a few others in mind like a FemboyShota QA a Loli QA for those who want to just ask about regular Lolis a Vore QA and a Slave QA.,The world's most expansive question Answering Festival!
79,https://archiveofourown.org/works/49452106,Adult,As promised in the introduction of my Futa Loli QA heres one for Femboys though aside from Canonical Femboys you can also ask questions regarding regular male and female characters that are turned into Femboys personally I mostly wanna get questions regarding cute female characters that are turned into Femboys.,Cutie transforms from girl to boy
80,https://archiveofourown.org/works/20098381,Drama,Several minutes after midnight I finally dragged myself to the front door and tiredly waved my cardkey in front of the locking mechanism. A little red light told me Id improperly held the card or something. Groaning I tried a second time. This time thankfully the light was green. I grasped the handle and pulled the door open. The apartment sat in silent darkness.,Mysterious Late Night Door Opening
81,https://archiveofourown.org/works/43166505,Fiction,A dying cosmic entity from beyond the multiverse in search of someone to inherit its cosmic power has looked through millions of multiverses and has finally found someone with the infinite potential for its power. A certain boy who wishes to be a hero of justice and as the entity looked into countless versions of this boy it found the right one although this versions love for justice went beyond his ideal.,A dying cosmic entity seeks worthy heir for infinite power
82,https://archiveofourown.org/works/45664510,Drama,1 Rick Billings was all things considered a little nervous. Now this wasnt particularly uncommon. So many things had occurred in Ricks life over the past few months that his most recent experiences had all consisted of one bout of nervousness to the next. And it wasnt like he lived the most exciting life before all this. That said at least his friends had begun to expect it now.,"ick Billings, overwhelmed with anxious anticipation."
83,https://archiveofourown.org/works/43483821,Fiction,Octavia always hated school. Not because it was hard or because she was bullied. She was pretty good at just avoiding anybody troublesome so long as they werent faculty. The issue was that she hated being seen. She abhorred drawing attention to herself even the slightest look in her direction made her want to shrink deep into a hood that didnt exist to hide her face.,"Underperforming, undervalued overachiever seeks anonymity"
84,https://archiveofourown.org/works/41869827,Sci-fi,The Normal Duel Field Purgatory Stage. Graphite Edge and Green Grandee had accelerated for a small talk using a connection that was practically impossible to break through or eavesdrop. They were discussing what should be done about Brain Burst now when Grandee suddenly brought up a different matter. Lotus she has reached Level 10 hasnt she Yes she has. Graph nodded. Then the end is here at last for Trial 2.,The two accelerated to discuss privately.
85,https://archiveofourown.org/works/41817792,Dark Fanrasy,She grasped at her mother begging her not to go. The woman sneered down at her like a bug before kicking her away her small fragile body rolling across the ground. Her classmates stared down at her as if she were nothing turning away from her as inky darkness swirled around her. She ripped and pulled desperate to get free of the darkness reaching out.,"Mother kicks daughter away, peers laughing ."
86,https://archiveofourown.org/works/40837218,Fantasy,It was a rather calm day in Ainground. After having dealt with the prior events of Genesis trying to seemingly destroy Ainground and create the world of Aincrad in Sword Art Origins. Kirito and his group were finally able to relax even having finally befriended Tia after her end of things. They all sat around at one of the restaurants in game discussing what they would be doing next.,Quiet day in Aincrad with friends over lunch
87,https://archiveofourown.org/works/43212090,Drama,It was a nice day out relatively peaceful in the trailer park I called home. My cat and I had just spent our morning half hour outside the cat roaming about his mesh tent and tunnel setup me reclining in my chaise lounge. The cat was now back inside enjoying his promised treats. I however had chosen to go back outside to enjoy the cool midday weather.,Relaxing morning in trailer park with pet cat
88,https://archiveofourown.org/works/42494634,Sci-fi,The Discovery Altair VI a decent enough world to live on. Scientifically and technologically advanced as a member world of the Federated Sentient Planets they still managed to import some rather quaint artifacts from Earth. Like the restaurant Akadeanna Kestrel was now sitting in enjoying lunch and a respite from her university studies into ancient societies.,Sassy intergalactic restaurateur ponders life choices.
89,https://archiveofourown.org/works/12604300,Sci-fi,She was tired of it all. Tired of the fear. Of the running. Of hearing about yet another glorious day with the great Emperor Zarkon in charge. She was tired of her people having only the Fleets of only hearing legends about Vhiliinyar. Of every single Linyarii born bleached by the touch of space.Naayli was tired and she wasnt standing for it anymore.,"Tired of oppression, Naayli fights back."
90,https://archiveofourown.org/works/10899000,Fantasy,Son Goku had just gathered himself an armful of tasty pears for breakfast when he heard a loud crash. It sounded like it was coming from the edge of the forest. He dropped all but one of the pears which he crammed in his mouth as he ran to see what had made the noise. There was a crater next to Grandpas house. In the middle of it was a pod.,Strange object discovered in forest near home
91,https://archiveofourown.org/works/3970141,Sci-fi,She knew him everyone knew him Elder the future leader of the ship so when she saw him running from the Hospital one night after the solar lamp clicked off she thought it was a little strange. Typically when she saw him he was dignified mature even if he was ten years younger.,"She knew him, unusual late-night run"
92,https://archiveofourown.org/works/690121,Romance,It was almost dark now only a small thumbnaillike portion of the higher sun was poking above the horizon. Stella knew she should be heading back toward the base if she was to make it to the mandatory meeting Zane arranged for the evening but her feet kept on pulling her forward.,Mysterious woods pull lonely wanderer deeper
93,https://archiveofourown.org/works/23872723,Drama,July 4 2015 Saturday Dear Diary Let me introduce myself. My name is Alexander and I am 13. For some reason everyone calls me Allie. I have long shoulderlength hair that is a small bit curly under my ears. I usually sweep it to the right to keep it out of my eyes.,"young teenage girl with medium-length, curly hair"
94,https://archiveofourown.org/works/17338454,Romance,Waking up to gentle snoring behind me I could feel one of Jakes strong and warm arms wrapped around my naked torso. His front was pressed up against my side while I could hear his gentle snores next to me. I smiled inwardly. it had been a while since Jake and I had not only woken up together but been able to have dinner together and spend a very pleasant night together.,Warm embrace on tranquil morning
95,https://archiveofourown.org/works/9841136,Romance,1There are times I would have had to admit well mainly to myself that my life has had quite a few dramatic moments. For instance being Jake Riordans boyfriend did have its moments some a bit rockyOk extremely rocky ones.But the good ones outweighed them by a ton. Especially when he asked me to become his fiancé. Well things were definitely becoming much more interesting.,Dramatic relationship with ups and downs
96,https://archiveofourown.org/works/2009544,Romance,I had been working on part of Cloak and Daggers inventory making sure to enter a few new collectibles I had managed to track down a few weeks ago when there was a knock at the office door. It was early afternoon sunny and warm on this particular summer day though you wouldnt have been able to tell from being in the back office.,Summer workday interrupted by an unexpected visitor
97,https://archiveofourown.org/works/23380504,Drama,Helen Blythe glanced over the wares in the marketplace. She and her sisters Margy and Rose were there looking for things to liven up their new apartment as well as shop for groceries. It had been a few weeks since they moved to New York City after the death of their father.,"In need of home essentials, sisters browse marketplace."
98,https://archiveofourown.org/works/12437532,Drama,ISLAND July 10th 1944 Letter from Alison Mannering to Polly Sullivan Darling PollyYour offer a little while ago to take the children for the holiday was very kind and meant in the spirit of reassurance but Im afraid I may have to ask if that offer still stands To put it simply Im struggling.,1940s Wartime Family Struggles
99,https://archiveofourown.org/works/23901442,Adventure,The character lists are on The School of Adventure this is a sequel continuation..,Dark forest magical school adventure.
100,https://archiveofourown.org/works/23900719,Adventure,A brief introduction The Triplets mainly Len have started a school at Kirren Bay. Their main students so far are children of young adventurers and relations such as Felix and Felicity Maynard Kevin and Kester Russell and Lens own step children John and Josie Kirren also twins The school is set up for both mainstream education and also alternative approaches to keep the young adventurers interested.,Adventures in coastal town school.
101,https://archiveofourown.org/works/866713,Adventure,1947George Kirren and her cousins Julian Dick and Anne sat in the car thoroughly bored with the journey. I still think its a stupid idea muttered George. Itll just be another excuse for the press to try to catch us out in a lie about our adventures and its getting really boring. Julian ignored her his nose in a book.,"Stuck on long car ride, dissatisfied with the journey"
102,https://archiveofourown.org/works/11835996,Comedy,Dinah has often been characterized as rather temperamental what old women like to call incorrigible and modern behind her back but that doesnt mean that shes overreacting. Not at all.Honestly only half of the anxiety shes feeling is due to the train fiasco she thinks as she sets her small suitcase down on a bench nearby.,Train delays cause Dinah distress
103,https://archiveofourown.org/works/47921542,Fantasy,The Great Sorcerer Zed Kagari and his husband High Cleric Micah Kagari got married on a warm winters day. Which sounds weird but actually Zed just used some magic so that it was warm outside. They were 28 years old when it happened and were covered in many more scars than when they started dating mental and physical.,"Warm Winter Wedding, Magic and Scars"
104,https://archiveofourown.org/works/47650684,Mystery,Brock was not the perfect adventurer. This wasnt news to anyone. Liza was the perfect adventurer. Zed wasnt perfect but he sure as Fie came close. Even Micah was a better adventurer. Brock on the other hand was more suited for the covert operations of being a spy and a thief. He didnt go around stealing things willynilly. He wasnt stupid. He was practiced. He was good at what he did.,Brock is an imperfect adventurer compared to others.
105,https://archiveofourown.org/works/41170635,Fantasy,3rd POV POOF She heard something was it someone talking. Wait whats a someone or a something. What am i even doing Who even am i Izanami thought too her self.,"Mysterious sounds in darkness, self-doubt."
106,https://archiveofourown.org/works/38547186,Fantasy,Heden descendant of Wóden Gyda Children of Heden Beorn Eoh Mildwyn Children of Eoh Ottor Wǽfre Eriol Cwén Naimi Éadgifu Elves of Arda Children of Ottor Wǽfre and Cwén Hengest Horsa Children of Eriol and Naimi Éadgifu Vorindo Heorrenda Fíriel of the Last Ship who saw Círdan Celeborn and Galdor of the HavensErmon and Elmir first Men to be Woken by Nuin the elf.,Dark Age Elves awaken Lost Trawler Survivors
107,https://archiveofourown.org/works/41433543,Thriller,A man moved through the shadowed alleys and streets to avoid being seen by less than forgiving eyes. Everything felt heavy inside him hunger and exhaustion sapping every ounce of his being from him and making the wanderer dizzy as thunder clouds overhead threatened to downpour any second. I must keep moving... So weak... Wait...laughter...children...must go..no...must..keep..going...to ...wHerE...,Wanderer escapes inebriated city streets
108,https://archiveofourown.org/works/42178203,Fantasy,Prologue Wedged in amongst the gray office blocks and shopfronts lies a quaint three storey red brick building. If we were to climb the eight elaborately tiled steps and stand upon the landing before the carved double doors we would find the commemorative stone laid by Alexander Roberts Esq when the building was first commenced so long ago.,Classy yet neglected venue with mysterious past.
109,https://archiveofourown.org/works/38834205,Romance,The Nautilus was above the oceans surface so she could absorb what she needed from the sun before her captain sent his beloved ship beneath the safety of the waves once again along with her loyal crew.The crew and the league took advantage of the day to go onto shore for personal items or even just to enjoy a stroll on a surface that didnt move.,"The sun-seeking Nautilus prepared for descent."""
110,https://archiveofourown.org/works/32546833,Drama,When Tom was five years old his mother had gone away for what he assumed was an indefinite amount of time and Aunt Polly had neatly packed up all of his belongings into boxes his clothes and his toys and the little books with golden spines that Mama read nightly to him in bed.,Small boy's life put into storage.
111,https://archiveofourown.org/works/16581383,Drama,17891797 George Washington IndependentWashington was the first American President and in the opinion of many the best. Washington had previously served as commander of the American armies during the Revolutionary War where he had slain hundreds of redcoats single handedly riding on his giant bald eagle.,1789 Independent Eagle Rider slays Redcoats
112,https://archiveofourown.org/works/46597225,Drama,The persistent tapping of Hardins boot against the leg of my desk sends me over the edge. How am I supposed to study with the nuisance that is Hardin Scott. Steph decided it would be best for him to wait here our dorm room for the time being while her and Tristan make a stop at the corner store for alcohol. If you ask me Id say theyre doing more than buying alcohol.,Annoyed by persistent visitor
113,https://archiveofourown.org/works/44511247,Adventure,Terry I hear my father cry out with her voice. The source of the voice down the stairs. I cry to myself at the lack of sleeping in any longer and spring from my cramped yet inexplicably comfortable and happinessinducing cot. Its provided my so much pleasure over the years I will surely miss it in my new phase of life.,"Mother cries out downstairs, leaving restless child to bid farewell to beloved bed."
114,https://archiveofourown.org/works/43310733,Drama,Love Saves All Part 1 Tessa POVTessa Young smiled as her eyes grazed across the beautiful brick building that stood sturdy before her. The day was finally here. Her first day of college. She felt a small tug on her hand that eventually guided her forward through the crowd toward the building which displayed a sign that read Declan Hall.,Young woman starts new chapter with sense of excitement
115,https://archiveofourown.org/works/42067440,Romance,Hes more myself than I am. Whatever our souls are made of his and mine are the same. Emily Bronte Wuthering HeightsBath United Kingdom Told from Tessas P.O.V.I knew I should have hopped off my bike when it started pouring and I do mean pouring. It hadnt been raining for two minutes and I was already drenched. The bikes wheels wobbled worryingly on the cobblestones.,Dramatic Romantic Bicycle Ride in Rain
116,https://archiveofourown.org/works/37265083,Drama,Tom schaute aus dem Fenster des vollgepackten Tesla Model 3. Mit einem Ohr hörte er Tonys Monolog über die besten Jahre seines Lebens die ihm nun bevor stünden. Er erzählte von allen Mädchen die er schon auf Instagram angeschrieben hat. Sie waren noch nicht mal in Cambridge angekommen und schon schien es als wäre Tonys Terminkalender bis zum dritten Semester mit Partys und belanglosen Dates ausgebucht.,New wealthy party boy seeks similar experiences
117,https://archiveofourown.org/works/37323538,Adventure,Hi Dear Friend reading thisIve made a decision. I may never emerge alive from this but I am determined. I will be reading After the fanfic. Note I will not comment on the movie or the book. I am going to be reading the fanfic the original the place where it all started. I am going to be writing notes every chapter commenting on everything from the plot to the characters to writing style.,Daring adventure into unknown depths.
118,https://archiveofourown.org/works/37266226,Drama,Tom looked out the window of the packed Tesla Model 3. With one ear he heard Tonys monologue about the best years of his life that were yet to come. He talked about all the girls he has already written to on Instagram. They hadnt even gotten to Cambridge yet and it seemed like Tonys thirdsemester schedule was filled with parties and casual meaningless dates.,"Sunny day, car ride, future plans"
